"See discussions, stats, and author profiles for this publication at: https://www.researchgate.net/publication/227621169"
Spatial price dynamics and integration in Russian food markets
Article  in  The Journal of Policy Reform · May 1999
DOI: 10.1080/13841289908523402 · Source: RePEc
CITATIONS READS
64 179
"3 authors, including:"
Barry Goodwin Thomas Grennes
North Carolina State University North Carolina State University
"260 PUBLICATIONS9,366 CITATIONS66 PUBLICATIONS1,651 CITATIONS"
SEE PROFILE SEE PROFILE
Some of the authors of this publication are also working on these related projects:
sovereign wealth funds View project
Finding the Tipping Point View project
All content following this page was uploaded by Thomas Grennes on 23 May 2014.
The user has requested enhancement of the downloaded file.
